codigo_ise;nome_ise;nome_cvm;cnpj;setor;uf;participacao_pct
AZZA3;AZZAS 2154;AZZAS 2154 S.A.;16.590.234/0001-76;Têxtil e Vestuário;MG;0,503
BBAS3;BRASIL;BANCO MERCANTIL BRASIL SA;17.184.037/0001-10;Bancos;MG;2,567
CMIG4;CEMIG;CEMIG DISTRIBUIÇÃO S/A;06.981.180/0001-16;Energia Elétrica;MG;2,715
CMIG4;CEMIG;CEMIG GERAÇÃO E TRANSMISSÃO S/A;06.981.176/0001-58;Energia Elétrica;MG;2,715
CMIG4;CEMIG;CIA ENERG MINAS GERAIS - CEMIG;17.155.730/0001-64;Energia Elétrica;MG;2,715
MRVE3;MRV;MRV ENGENHARIA E PARTICIPAÇÕES S/A;08.343.492/0001-20;Construção Civil, Mat. Constr. e Decoração;MG;0,499
TIMS3;TIM;BANCO MERCANTIL DE INVESTIMENTOS S.A.;34.169.557/0001-72;Bancos;MG;2,837
USIM5;USIMINAS;USINAS SID DE MINAS GERAIS S.A.-USIMINAS;60.894.730/0001-05;Metalurgia e Siderurgia;MG;0,651
USIM5;USIMINAS;USINAS SID DE MINAS GERAIS S.A.-USIMINAS;60.894.730/0001-05;Metalurgia e Siderurgia;MG;0,651
